commit	val_bpb	tokens_M	steps	memory_gb	status	description
47860c7	1.417002			18.6	keep	baseline (MuonAdamW + mx.compile)
fdf2956	1.360758			21.2	keep	increase depth from 2 to 4 (model_dim 256)
2a0496d	1.423965			21.1	discard	halve total batch size to 2^13 (device batch 4)
b3c638d	1.378900			21.4	discard	SwiGLU MLP replacing squared ReLU
b2fc315	1.373438			21.2	discard	increase matrix LR from 0.04 to 0.06
805d9ea	1.448067			22.5	discard	depth 5 (model_dim 320) with warmup 0.10
6008635	1.379877			21.2	discard	reduce warmdown ratio from 0.30 to 0.15
1381e07	1.425563			21.1	discard	disable value embeddings
c23c59e	1.373087			21.2	discard	enable VE on all layers (was alternating)
1d7e7dd	1.388757			20.6	discard	reduce MLP expansion from 4x to 3x
adbc71e	1.529351			19.5	discard	HEAD_DIM 64->32 (8 heads of 32 instead of 4 of 64)
b76dc62	1.381566			21.2	discard	cosine warmdown schedule (replace linear decay)
14a54a2	1.407538			21.2	discard	depth 6 with model_dim 256 (ASPECT_RATIO=42)
4e18b22	1.379257			21.2	discard	double batch size (DEVICE_BATCH_SIZE=16 TOTAL_BATCH_SIZE=2^15)
9b60c82	1.375692			21.2	discard	increase matrix LR from 0.04 to 0.05
02bfdef	1.401088			22.5	discard	increase model width to 320 (ASPECT_RATIO=80)
c47f355	1.373827			22.2	discard	increase MLP expansion from 4x to 6x
71d6dc4	3.290099			21.1	discard	weight tying (share wte and lm_head weights)
c66422b	3.295559			21.1	discard	reduce Muon ns_steps from 5 to 3 (TAINTED: weight tying not reverted)
73382a2	3.312070			21.1	discard	halve weight decay 0.2->0.1 (TAINTED: weight tying not reverted)
42caa55	1.364382			21.2	discard	halve weight decay 0.2->0.1 (clean retest)
2d90f5f	1.372535			21.2	discard	increase embedding LR from 0.6 to 1.0
5f5d4de	1.362484			21.2	discard	all full-attention layers (WINDOW_PATTERN=L instead of SSSL)
98e7475	1.363695			21.2	discard	z-loss regularization (1e-4 coefficient)
42340b3	1.366251			21.2	discard	reduce warmdown ratio from 0.30 to 0.20
34b5923	1.364753			21.1	discard	full attention + weight decay 0.15 (combining near-misses)
e124179	1.364023			21.2	discard	SL window pattern (alternating sliding/long attention)
e97d7a5	1.367038			21.2	discard	reduce Muon ns_steps from 5 to 4 (faster steps more tokens)
fa8842b	1.657490			21.2	discard	label smoothing 0.1 (too aggressive; hurts eval bpb)
bf39c34	1.392430			21.2	discard	depth 5 with model_dim 256 (ASPECT_RATIO=51; slower steps hurt)
4b8902e	1.370069			21.2	discard	RoPE base frequency 10000 -> 50000
210c2c3	1.372004			21.2	discard	increase logit soft-cap from 15 to 30
7aa2e44	1.305247			21.1	keep	GQA with n_kv_head=2 (half KV heads for faster steps)
8829baa	1.283247			21.2	keep	depth 6 with GQA (ASPECT_RATIO=42 keeps model_dim=256)
7075d0d	1.301109			21.2	discard	depth 8 with model_dim 256 (ASPECT_RATIO=32; slower steps hurt throughput)
e92cb59	1.330026			21.2	discard	depth 7 with model_dim 256 (ASPECT_RATIO=36; still slower than depth 6)
7f13638	1.345895			21.1	discard	MQA with n_kv_head=1 (too aggressive; quality loss outweighs speed gain)
c5fb70a	1.311165			21.2	discard	reduce weight decay 0.2 -> 0.1 (with depth 6 + GQA)
3ac97fe	0.000000			0.0	crash	wider model 320 (ASPECT_RATIO=48) — n_head=5 not divisible by n_kv_head=2
ce2e51c	1.407101			21.4	discard	SwiGLU MLP with FLOP-matched 8/3 expansion (depth6 + GQA)
f0f25bb	1.409689			21.1	discard	full attention (WINDOW_PATTERN=L) with depth 6 + GQA
a391d79	1.441161			21.2	discard	reduce Muon ns_steps from 5 to 3 (quality loss outweighs speed gain)
1a5e974	1.418396			21.2	discard	increase matrix LR from 0.04 to 0.05 (depth 6 + GQA)
1bf6351	1.406486			22.2	discard	parallel attn+MLP (PaLM-style shared norm per block)
8197f59	1.429589			20.2	discard	depth 8 with 2x MLP expansion (too slim; capacity loss outweighs speed gain)
5697a23	1.276848			21.2	keep	remove warmup (WARMUP_RATIO=0; zero-init makes warmup unnecessary)
a5a8943	1.416208			21.2	discard	reduce matrix LR from 0.04 to 0.03 (worse without warmup)
f62d5c3	1.428869			21.2	discard	double total batch size 2^15 (grad accum 2x slows steps; fewer optimizer updates)
ac07e7d	1.442529			21.2	discard	SSLL window pattern (more full-attention layers 4/6 vs 2/6; slower steps)
729d1fe	1.440811			21.2	discard	increase warmdown ratio 0.3->0.4 (longer cooldown hurt; worse convergence)
639cb4f	1.442664			21.2	discard	increase embedding LR from 0.6 to 0.8 (much worse; embeddings overfit faster)
80a83ec	1.470961			21.2	discard	shorten momentum warmup 300->50 steps (much worse; premature high momentum destabilizes)
222dd4d	1.450454			21.2	discard	reduce embedding LR 0.6->0.4 (much worse; embeddings learn too slowly)
2860146	1.466512			21.2	discard	increase unembedding LR 0.004->0.01 (much worse; destabilizes lm_head)
c907d68	1.469385			21.2	discard	increase AdamW beta1 0.8->0.9 (much worse; slower adaptation hurts)
36d3b8f	1.453952			21.2	discard	constant weight decay (no decay-to-zero; much worse; over-regularization late in training)
297f0b5	1.584802			23.7	discard	widen model to 384 dim (ASPECT_RATIO=64; 6 heads 3 KV heads; much worse)
ccc3adb	1.597130			21.2	discard	global gradient norm clipping max_norm=1.0 (too aggressive + .item() sync slowed training)
3f0797d	1.516801			21.2	discard	remove logit soft-capping (much worse; soft-cap stabilizes training)
96894f8	1.411738			21.2	discard	reduce logit soft-cap from 15 to 12 (tighter cap over-constrains logits)
5e18a9a	1.361784			26.4	discard	remove x0 residual connection (1.362 vs 1.277; x0 highway essential for quality)
2a94e0b	1.295582			26.4	discard	init scale 0.68 (upstream narrow optimum; worse on our hardware/depth)
b428bc2	1.317104			21.2	discard	FINAL_LR_FRAC 0.05 (LR floors at 5%; restored correct baseline with x0 residual)
729d778	1.320213			21.2	discard	x0_init 0.05 (reduce x0 skip scalar from 0.1 to 0.05; worse quality)
543dda6	1.315882			21.2	discard	momentum warmup 200 (reduce from 300 to 200; worse quality)
8e0a7d7	1.317625			21.2	discard	embedding weight decay (wte=0.001 ve=0.003 lm_head=0.01; worse quality)
aa845ce	1.310544			21.2	discard	WARMDOWN_RATIO 0.75 (most of training is warmdown; worse 1.311 vs 1.277)
0399e37	1.307058			21.2	discard	short window seq_len/8 (256 tokens; less attention compute but worse quality)
c774e47	1.309926			21.2	discard	RoPE base 200K (from 10K; worse quality 1.310 vs 1.277)
9732b78	0.000000			0.0	crash	EMA weights (decay=0.995) — load_weights KeyError on mixed list/dict tree
6b18813	0.000000			0.0	crash	float16 weights (NaN at step 117 — squared ReLU overflows f16 max 65504)
27a43ec	1.387586			21.2	discard	sequence length curriculum (1024→2048 at 50%; short seqs hurt quality)
4cbb2ed	1.435048			21.2	discard	attention scale=1.0 (QK-norm makes 1/sqrt(d) unnecessary; much worse)
27530ad	1.407379			21.2	discard	GELU activation instead of squared ReLU (much worse; squared ReLU better at this scale)
bdb9c17	1.393179			21.2	discard	short_window seq_len/4 (512 tokens; too aggressive quality loss vs 1024)
b8c77dd	1.400399			21.2	discard	x0_init 0.15 (increase x0 skip from 0.1 to 0.15; too strong)
4cf3a8e	1.413052			21.2	discard	increase Muon target momentum 0.95->0.97 (destabilizes training)
270800d	1.410547			21.2	discard	remove NorMuon variance reduction (much worse; variance normalization essential)
758caa2	1.406190			21.2	discard	remove cautious weight decay mask in Muon (standard decoupled WD; much worse)
0b50394	1.437584			21.2	discard	deep supervision with aux loss from mid-layer (layer 3/6 weight 0.1; much worse)
54a9162	1.323664			21.2	discard	remove resid_lambdas (simplify residual to x + x0_lambda*x0; worse 1.324 vs 1.277)
9e47b25	1.312417			21.2	discard	Muon beta2 0.95->0.90 (faster NorMuon variance adaptation; worse 1.312 vs 1.277)
7e1c733	1.545293			26.5	discard	EMA weights (decay=0.995) — much worse 1.545 vs 1.277; averages in early bad weights + 27GB memory
e7e2cc5	1.334776			21.2	discard	increase weight decay 0.2->0.25 (stronger regularization hurts; 1.335 vs 1.277)
f7a7b3d	1.310847			21.2	keep	baseline re-verify at 10min budget (mechanical run, best config + infra fixes)
c715df7	1.385528			21.1	discard	shared VE embedding (single table across all VE layers; 1.386 vs 1.311 baseline)
c8a7d25	1.314580			20.7	discard	reduce MLP expansion 4x to 3x (21% more tokens but capacity loss; 1.315 vs 1.311)
04b4612	1.310873			21.2	discard	reduce weight decay 0.2->0.15 (identical to baseline; 1.311 vs 1.311)
0323a60	1.325706			21.2	discard	multi-token prediction (2nd-next token aux head weight 0.3; worse 1.326 vs 1.311)
ee345ec	1.448732			21.2	discard	halve SCALAR_LR 0.5->0.25 (much worse; residual scalars need fast adaptation)
c24f934	1.426836			21.2	discard	partial RoPE (rotate only 32/64 head dims; much worse; full rotary essential)
dce09b6	1.412310			21.2	discard	halve batch size (DEVICE_BATCH_SIZE=4 TOTAL_BATCH_SIZE=2^13; noisier grads hurt more than extra updates help)
c9457ea	1.456648			21.2	discard	residual dropout 0.05 (much worse 1.457 vs 1.311; dropout noise prevents convergence in ~500 steps)
490cdb6	1.421442			21.2	discard	WARMDOWN_RATIO 0.65 (full-LR for only 3.5min + long 6.5min cooldown; much worse 1.421 vs 1.311)
b620e8d	1.443647			21.2	discard	depth 8 at 10min (ASPECT_RATIO=32; model_dim=256 same GQA; much worse 1.444 vs 1.311; 453 steps not enough for deeper model)
755730d	1.516021			21.2	discard	cosine LR with warm restart (2 cycles; 2nd at 0.5x max LR; much worse 1.516 vs 1.311; restart disrupts learned representations)
c065579	1.429942			21.2	discard	Muon beta2 0.95->0.99 (smoother NorMuon variance; much worse 1.430 vs 1.311; too slow to adapt in 556 steps)
a000c1e	1.431694			21.2	discard	Muon initial momentum 0.90 (from 0.85; much worse 1.432 vs 1.311; higher start momentum destabilizes early training)
f1ba6b5	1.429988			21.2	discard	logit soft-cap 20 (from 15; too loose; much worse 1.430 vs 1.311)
dd2140b	1.432561			21.2	discard	centered norm (LayerNorm-style mean subtraction; much worse 1.433 vs 1.311; DC component needed)
8a7b0bb	1.431247			21.2	discard	learnable per-head attention temperature (scale q after QK-norm; much worse 1.431 vs 1.311; destabilizes attention)
4014e21	1.425569			21.2	discard	non-traditional RoPE (Llama-style interleaved dim pairing; much worse 1.426 vs 1.311)
dd05a8f	1.422229			21.2	discard	all-sliding-window (WINDOW_PATTERN=S; only last layer full attention; 1.422 vs 1.311)
bea8bc8	1.403716			21.2	discard	sub-LN sandwich norm (norm after each sub-layer output; 1.404 vs 1.311 baseline)
cad8945	1.356563			21.2	discard	sqrt warmdown schedule (cooldown^0.5 keeps LR higher longer; 1.357 vs 1.311 baseline)
08f090f	1.311322			21.2	discard	bookend attention (LSSSS window; full attn at first+last layer; 1.311 vs 1.311 baseline)
2fd4f96	1.309363			21.2	keep	sigmoid skip gates (resid_lambdas through sigmoid; init 1.5 → ~0.82; bounded residual scaling)
57b2350	0.000000			0.0	crash	SWA during warmdown (378 snapshots averaged; training OK but eval crashed: mask type mismatch after weight replacement)
3a509be	1.314170			21.2	discard	trapezoidal LR schedule (5% warmup + 35% full LR + 60% warmdown; long warmdown hurts)
654de9a	1.305475			21.2	keep	reduce weight decay 0.2->0.15 (retest with sigmoid gates; synergizes for new best)
4580087	1.312934			21.2	discard	U-Net skip connections (layer 0→5 1→4 2→3 with learnable gates; worse 1.313 vs 1.305; x0 residual sufficient)
0b7f25c	1.308248			22.2	discard	per-layer MLP scaling (3x early 6x late; FLOP-matched capacity reallocation; 1.308 vs 1.305)
cc6bbc8	1.303995	20.6	1258	21.7	keep	learnable RMSNorm (nn.RMSNorm with gain for pre-attn pre-MLP final norms; bare norm kept for QK/embed)
